,date,confer_num,confer_name,con_name_kr,speaking
0,2022-10-27,52260,국회본회의_제400회_제11,이은주,"사랑하는 동료시민 여러분!   존경하는 김진표 국회의장님과 선배․동료 의원 여러분!   정의당 비대위원장 원내대표 이은주 의원입니다.    수원에서 세 모녀가 사망한 지 석 달이 지났습니다. 같은 달 광주에서 보호종료청년이 생을 비관해 목숨을 끊었습니다. 신당역에서는 여성 노동자가 동료에게 스토킹 살해를 당했고 얼마 전 국내 최대 제빵업체에서 갓 스물을 넘긴 청년이 반죽기계에 몸이 끼어 숨졌습니다. 모두 두세 달 사이에 일어난 일들입니다.    마땅히 사회가 보호했어야 할 시민들입니다. 정치가 대안과 해법을 가져야 할 문제들이었습니다. 복지전달체계는 정작 약자들에게는 작동하지 않고 있습니다. 여성들에게 스토킹의 끝은 죽음입니다. 30만 원짜리 안전센서를 붙이지 않아 사망재해가 발생했습니다. 희생자들은 우리 사회가 얼마나 고장 났는지를 바로 자신의 죽음으로 고발한 것입니다.    그러나 이런 이야기들은 더 이상 우리 정치의 작은 뉴스거리도 되지 않습니다. 잠시 관심을 갖는 척하지만 곧 집단적 기억상실에 걸리는 것이 오늘날 한국 정치입니다.   대신 우리 정치를 지배하고 있는 이슈는 친일파 대 주사파입니다. 제1야당 대표가 앞장서 일본과의 군사협력을 친일국방이라 말씀하고 대통령이 직접 주사파 논쟁에 뛰어들었습니다.    저는 묻습니다. 친일파와 주사파가 과연 현존하는 위협입니까? 친일국방 논란은 지난 정권의 죽창가처럼 외교안보 현안을 국내 정치에 이용하려는 욕망에서 시작된 것입니다. 한일 방위협력은 윤석열 정부의 독자적 작품이 아니라 이미 역대 정권에서 조금씩 확대되어 왔습니다. 체제 경쟁은 진작에 끝났고 북한 체제를 대한민국에 이식하려는 집단을 시민은 결코 용납하지 않습니다. 주사파는 오직 우파 유튜버와 김문수 경제사회노동위원회 위원장 같은 집단에서만 존재하는 위협, 아니 망상일 뿐입니다.   정치가 가상의 공포를 앞세운 사이 복지체계의 공백, 직장 내 성폭력, 산업재해와 같은 우리 삶에 현존하는 위협은 무시되고 있습니다. 적대적 정치는 정치의 힘을 가장 필요로 하는 힘없는 약자들에게서 공공정책이 자신의 삶을 개선시킬 수 있다는 기대를 빼앗고 있습니다. 적대적 정치는 사회의 평화를 부수고 시민들이 서로를 향해 고함치고 화내도록 만들고 있습니다. 자기 진영의 최대 결집을 위해 공동체의 안녕을 파괴하는 이런 정치는 나쁜 정치입니다. 아니, 정치도 아닙니다.    정치의 정상화, 정치의 부활이 절실합니다. 민주화 이후 거듭되는 정치의 실패를 극복하지 않고는 불평등과 기후위기, 차별과 혐오 같은 우리 삶과 지구공동체에 대한 위협을 해결할 수 없습니다. 경제지표의 성장은 이뤘지만 사회는 저성장하고 국가는 풍요롭지만 시민의 가난한 상황을 극복할 힘은 오로지 정치에서 나옵니다. 지금은 나쁜 정치이지만 그렇기에 우리 사회의 다른 영역보다 더 나아질 여지가 있다고 저는 믿고 있습니다.    적대적 정치를 끝내기 위해 정부, 여당 그리고 제1야당에게 진심으로 말씀드리고자 합니다.   첫째, 대통령은 반민주적 의회 모독을 결자해지해야 합니다.    저는 문재인 대통령은 김일성주의자라는 김문수 경사노위 위원장의 발언을 바로 눈앞에서 들었습니다. 믿을 수가 없었습니다. 그러나 그 망언보다 더 심각했던 것은 주사파는 협치의 대상이 아니라는 윤석열 대통령의 발언입니다. 전직 대통령이 김일성주의자고 야당 의원도 마찬가지라는 의회와 정치를 모독하는 망언에 대통령은 정당성을 부여했습니다. 그 해악은 김문수 위원장보다 더 큽니다.    방미 문제도 마찬가지입니다. 욕설의 대상이 바이든 대통령이 아니라 국회라면 정말 아무런 문제가 안 되는 겁니까? 대통령 없는 민주주의는 있어도 의회 없는 민주주의는 지구상에 존재하지 않습니다.    윤 대통령의 의회에 대한 적대감은 이전 정부들과 한 치도 다르지 않습니다. 대통령이 직접 해결하십시오. 김문수 위원장 같은 극렬 인사를 사퇴시키고 자신의 실언에 대해 사과해야 합니다. 그래야 의회에서 여야 대화 복원의 계기가 마련될 수 있습니다. 총선까지 아직도 2년이 남았고 이 내전 상태를 끌고 간다면 정부 실패는 예견돼 있다는 것을 명심하십시오.    둘째, 사정기관을 앞세운 통치를 중단해야 합니다.    내 사전에 정치보복은 없다던 대통령의 공약은 결국 식언이 됐습니다. 검찰은 제1야당 대표를 정조준하고 있으며 감사원은 전임 정부의 각료 전체를 감옥에 보낼 태세입니다. 잘못했다면 처벌할 수 있어야 합니다.   하지만 통치자에게 주어진 그 무서운 권한은 마땅히 절제라는 덕목 속에 행사되어야 합니다. 정치적 반대파에 대한 무자비한 사정은 단 한 번도 통치의 성공을 가져온 바 없습니다. 심지어 자신을 죽이려고 했던 이들마저 용서한 고 김대중 전 대통령이 왜 지금까지 성공한 대통령으로 기억되겠습니까?    그러나 윤석열 정부의 사정통치는 선을 넘어도 한참 넘었습니다. 독립적 기관인 감사원은 어느새 대통령실에 문자를 보내고 직보를 하는 기관으로 전락했습니다. 내부 절차를 어긴 감사는 물론이며 탈원전에 이어 소득주도성장까지 전임 정부의 정책 전체를 범죄화하려는 욕망에 빠져 있습니다. 여기에 대통령의 의중이 반영되지 않았다고 믿는 시민은 별로 없을 것입니다.    전임 정부의 정책에 대한 심판은 선거에 참여하는 시민의 평가에 맡겨 두어야 합니다. 폭주하는 사정기관을 제어하지 않는다면 5년 뒤 똑같은 일이 반복됩니다. 그것은 한 정치집단의 불행이 아니라 우리 정치 전체의 불행입니다. 이 악순환을 끊는 결단을 내리십시오.    셋째, 제1야당에도 말씀드립니다.    특검 국회를 민생 국회로 전환합시다. 이번 주 민주당사가 검찰로부터 압수수색을 당하면서 정국은 급속히 냉각됐습니다. 대부분의 국정감사는 중단되고 대통령 시정연설은 반쪽이 됐습니다.    대선자금 문제로 야당 대표가 수사선상에 오르는 불행한 사태가 오지 않기를 바랐습니다. 떳떳하다는 이재명 대표의 말씀을 신뢰하고 싶습니다. 그렇다면 가장 가혹한 자들에게 수사를 맡기고 결백을 증명하는 정공법을 택해야 합니다.   가장 우려스러운 점은 특검에 대한 찬반 문제로 정기국회가 파행되는 것입니다. 제1야당 주도의 특검법 발의는 국회의 기능 정지를 불러올 것입니다. 정의당은 검찰 수사와 공소장을 지켜보고 특검 여부를 판단할 것입니다.    우리에게는 특검보다 훨씬 더 절실한 문제들이 기다리고 있습니다. 사각지대 없는 온전한 손실보상, 기초연금 인상, 디지털성범죄피해자원스톱지원센터 같은 이재명 대표께서 말씀하신 과제들을 정기국회에서 실천하기 위해서라도 특검이 정치의 블랙홀이 되는 일이 없도록 재고해 주실 것을 호소드립니다.    존경하는 선배․동료 의원 여러분!   윤석열 대통령은 취임식 연설에서 자유를 서른다섯 번 언급했습니다. 주요 행사에서 자유를 거듭 강조하고 있습니다. 좋습니다. 자유는 보수만의 가치가 아니라 진보에게도 핵심 가치입니다. 다만 지금 우리 사회에 어떠한 자유가 더 중요한지에 대해 견해의 차이가 있을 뿐입니다.    프랭클린 루스벨트 대통령은 2차 대전 참전을 앞두고 의회에서 ‘네 가지 자유’라는 명연설을 했습니다. 언론과 표현의 자유, 종교의 자유, 결핍으로부터의 자유, 전쟁이라는 공포로부터의 자유를 본질적인 자유라고 말했습니다. 자유시장이나 국가나 군주의 억압이 없는 것 같은 소극적 의미가 아니었습니다. 대공황과 빈곤, 불평등으로부터 시민을 자유롭게 하자는 적극적 자유였습니다.   루스벨트 정부는 이를 실현하기 위해 결사의 자유를 선택했습니다. 미국 최초의 여성 장관인 프랜시스 퍼킨스 노동부장관을 임명해 전국노동관계법을 비롯한 개혁을 추진했습니다. 노동자의 단결권을 강화하고 쟁의행위에 대한 민사면책을 신설하고 부당노동행위를 처벌했습니다.    그리고 결사의 자유 확대는 루스벨트 정부만의 선택이 아니었습니다. 파시즘 격퇴를 막 앞둔 1944년 필라델피아에서 ILO는 노동은 상품이 아니다, 표현의 자유와 결사의 자유는 지속적 진보를 실현하기 위한 필수적 요소라고 선언했습니다.   인류는 결사의 자유를 핵심적 자유권으로 인정하면서 비로소 야만과 결별했던 것입니다. 우파는 착취를 포기하고 좌파는 폭력혁명을 포기하는 타협과 정당과 노동조합의 자유로운 활동을 보장하는 합의로 현대 민주주의는 번영과 발전을 이루었습니다.    그러나 현대 민주주의를 탄생시킨 이 위대한 결사의 자유는 대한민국에서 아직도 철저히 부정당하고 있습니다. 지난 14년간 쟁의행위로 노동조합과 개인에게 청구된 손해배상금액은 2753억 원입니다. 최근 대우조선 하청노동자에 대한 470억 원 손배처럼 몇십 년, 아니 몇백 년이 지나도 갚지 못할 금액이 청구되고 있습니다. 쌍용자동차 노동자의 희생이 입증했듯 그 고통은 죽기 전에는 결코 끝나지 않습니다.    사용자 측의 손배소 취하는 노조탈퇴, 희망퇴직, 근로자지위확인소송 철회 같은 부당노동행위로 이어져 우리 헌법 33조의 노동삼권을 부정하는 사례가, 거래가 되었습니다.    노란봉투법은 손배 노동자가 불쌍해서 연민하기 위해 만든 법이 결코 아닙니다. 헌법상의 기본권이며 인류가 이룩한 결사의 자유를 보호하기 위한 법입니다. 하지만 벌써부터 대통령 거부권이 이야기되고 있습니다.    분명히 말씀드립니다. 노란봉투법에 대한 거부는 자유에 대한 거부입니다. 거부권 행사는 대한민국을 영원히 자유의 사각지대이자 반문명국가로 남겨두게 될 것입니다.    정의당은 이번 정기국회를 노란봉투법을 입법하는 옐로우 윈터(Yellow Winter)로 만들 것입니다. 당원들은 거리에서 시민들과 캠페인을 펼칠 것입니다. 의원단은 국회에서 온 힘을 다해 노란봉투법의 필요성을 동료 의원 여러분과 논쟁하고 토론해 합의점을 만들 것입니다.    이번 정기국회를 결사의 자유라는 우리 헌법의 약속을 실현하는 국회로 함께 만듭시다.   존경하는 선배․동료 의원 여러분!   고금리, 고물가, 고유가와 지정학적 위기가 복합된 위기로 약자의 삶이 위험에 처해 있습니다. 기록적 폭우로 반지하방 주거약자들이 희생돼 기후위기가 가난한 사람들을 가장 먼저 위협한다는 것을 확인했습니다. 신당역 스토킹 살해처럼 일상이 된 젠더 폭력과 약자와 소수자에 대한 증오와 혐오를 끝내지 않으면 일상의 평화와 사회의 통합은 불가능합니다.   약자를 위한 정기국회가 되어야 합니다.   정의당은 이번 정기국회에서 ‘노동자․무주택자․자영업자 권익 강화’ ‘기후위기 대응’, ‘차별․폭력, 증오의 정치를 넘기 위한 정치개혁, 사회개혁’이라는 3대 과제를 추진하겠습니다.   일하는 시민 기본법으로 플랫폼, 프리랜서, 자영업자 같은 모든 일하는 시민의 기본권과 단결권을 보장하겠습니다.   SPC그룹 허영인 회장에 대한 국회 청문회를 성사시켜 청년 노동자의 죽음에 대한 사과와 방지책을 받아 내겠습니다. CEO 처벌 조항 삭제 등으로 윤석열 정부가 사실상 중대재해법을 폐지하려는 시도를 단호히 막겠습니다.   반지하 비극을 막기 위해 주거복지를 강화하는 주거기본법과 주거급여법을 개정하고 다중채무자와 같은 금융약자를 위한 정책금융을 확대하며 개인회생․파산제도는 정비하겠습니다.   쌀 생산에 들어가는 주요 농자재 비용과 인건비가 천정부지로 올라 농사를 열심히 지으면 지을수록 손해가 커지고 있습니다. 자동시장격리를 의무화하고 시장격리 시 역공매를 금지하는 방향으로 양곡관리법을 개정하고 농민의 노동이 합당한 대우를 받을 수 있도록 해야 합니다.   정부의 온실가스감축인지예산과 일자리전환사업을 철저히 점검하고 기후위기 대응을 위한 정의로운 일자리전환 기본법을 추진하겠습니다.   정의로운 전환의 비용을 마련할 탄소세를 도입하고 배달라이더 전기이륜차 지원 강화 등 일상에서 탄소 배출을 줄이기 위한 정책도 빼놓지 않을 것입니다.   피해자 신변보호 등 스토킹 처벌법을 개정하겠습니다.   저항이 불가능한 폭행이나 협박이 있어야만 강간이라는 최협의설에 갇혀 성폭력 피해자를 보호하지 못하고 있는 형법의 강간죄를 개정하고 비동의강간죄를 도입하겠습니다.   차별금지법으로 사회 곳곳에서 벌어지는 차별과 혐오를 막고 모든 시민이 존엄한 사회를 만들겠습니다.   윤석열 정부의 2023년 예산은 건전예산이 아닙니다. 공공축소 민자 퍼주기 예산입니다. 재정건전성에 대한 우려보다 재정의 역할을 축소하고 시장으로 기능을 이전하려는 불건전한 의도가 다분합니다.   또한 이번 예산은 부자감세․민생삭감 예산입니다. 법인세 인하, 가업상속공제 기준 완화로 부의 대물림을 안정적으로 보장했습니다. 부자감세안을 밀어붙인다면 그 결과는 최근 영국과 같은 파국이 될 것입니다. 부자감세는 지방교부세 교부액을 감소시켜 지방재정 또한 어려움을 겪게 될 것입니다.   약자복지를 강조했지만 사회안전망 구축과 사회적 약자 보호에 각각 31조 6000억과 26조 6000억을 편성해 전년보다 4조 2000억, 3조 4000억만 증액됐습니다. 사실상 자연증액분 수준으로 생색이나 다름없습니다.   기후인지예산은 10조 원 정도로 유엔이 제시한 기후예산 GDP의 2%, 40조 원의 4분의 1 수준이며 대한민국을 영원히 기후악당국가로 남게 할 것입니다.    정부의 예산안을 결코 이대로 통과시킬 수 없다는 것이 정의당의 입장입니다. 향후 예산심의 과정에서 문제점을 철저히 따져 묻고 약자를 위한 공공의 기능을 복원하고 기후위기 극복을 위한 예산을 회복시킬 것을 약속드립니다.   사랑하는 동료시민 여러분!   정의당은 내일 7기 대표단 선출을 완료하고 5개월간의 비상대책위원회도 막을 내립니다. 저도 이제 원내대표로 돌아갑니다. 그간 정의당 10년평가위원회를 통해 당의 노선과 조직․재정, 총선 전략을 진단했습니다.   리더십 강화를 위해 당대표 중심의 단일지도체제로 개편하고 노선과 정체성에 대한 전면 혁신을 결의한 재창당 방침이 당대회에서 확정됐습니다. 일하는 사람들과 약자들의 삶 속에서 정의당의 새로운 노선을 찾기 위해 노력했습니다.   발달장애인 가족의 참사를 끝내기 위한 활동지원 서비스와 다양한 지원체계를 약속드렸습니다. 배달 라이더 노동자들의 안전배달과 노동권 보장을 위한 TF를 함께 구성해 논의를 이어 오고 있습니다. 대우조선 하청 노동자들의 투쟁에 함께 한 과정은 정의당의 존재 이유와 가능성을 확인한 과정이었습니다.   국정감사가 진행되고 다른 정치 이슈들로 인해 이번 정의당의 당직선거는 크게 부각되지는 못했습니다. 하지만 동일노동 동일임금을 위한 임금체계 논쟁을 비롯해서 양대 정당에서도 해 보지 못한 당내 토론이 치열하게 펼쳐졌습니다. 혼돈의 정치노선을 정비하면서도 새로운 연합정치의 원칙을 찾기 위한 사려 깊은 논의도 있었습니다.   무엇보다 아직까지 진보정치의 가능성을 신뢰하는 당원들과 지지자들의 마음을 확인할 수 있는 시간들이었습니다.   물론 정의당의 위기를 극복하고 혁신을 완수했다고 말씀드릴 수 있는 단계는 아닙니다. 내일 선출되는 신임 지도부와 함께 저 또한 지도부의 일원으로서 정의당을 다시 일으켜 세우기 위한 노력을 계속하겠습니다.   진보정치를 가장 필요로 하지만 정의당을 아직 경험하지도 알지도 못하는 분들에게 향하겠습니다. 그럴 때 진보정치의 가능성은 현실이 되고 정의당은 거대 양당의 대안이 될 수 있을 것입니다.   정의당의 앞길에 많은 격려와 관심을 부탁드립니다.   감사합니다.     (박수)      "
1,2022-10-27,52260,국회본회의_제400회_제11,강민정,"존경하는 국민 여러분!   김진표 국회의장님과 동료 의원 여러분!   더불어민주당 국회의원 강민정입니다.   바야흐로 퇴행의 시대입니다. 요즘 우리는 가히 전방위적 퇴행을 곳곳에서 목도하고 있습니다. 교육이라고 예외는 아닙니다. 교육 분야 인사와 예산을 보면 그렇습니다.   김영삼․이명박 정부를 거치며 대학설립 준칙주의 도입으로 부실대학이, 고교 다양화 정책으로 특권학교가, 일제고사 전면화로 무한경쟁체제가 들어서게 한 사람, 누구일까요?   윤석열 정부 세 번째 교육부장관후보 이주호입니다. 그런 그가 반성은커녕 다시 교육계 수장이 되겠다고 돌아왔습니다.   박근혜 후보를 선덕여왕이라 칭송하고 국가가 정한 단 하나의 역사만을 가르쳐야 한다며 역사교과서 국정화에 앞장서 나라 전체를 혼란과 갈등의 소용돌이에 빠지게 한 인물, 누구일까요?   초대 국가교육위원회 위원장으로 임명된 이배용입니다. 이런 사람이 중장기 교육정책을 수립하고 논쟁적 교육 문제에 대한 사회적 합의를 이끌어 낼 수 있을까요? 통탄할 일입니다.   교육은 미래를 키우는 일입니다. 앞으로 가도 부족할 판에 오히려 과거로 되돌아가고 있습니다.   설상가상 이들은 이제 아이들 교육을 위한 예산 일부를 떼어 대학 예산으로 돌리자는 주장까지 합니다. 고등교육 위기에 대한 제대로 된 진단도 처방도 없이 가장 손쉬운 방법을 택하려 하고 있습니다. 아우 돈 떼어 형 주는 방식은 고등교육 문제 해결은커녕 초․중등 교육마저 위기로 몰아넣을 것입니다.   아파트도 30년이면 재건축 대상이 됩니다. 이들은 40년 이상 된 노후 학교건물이 1만 동이 넘고 지진 대비가 안 된 학교가 전체 43%를 넘어선다는 사실에는 관심이 없습니다. 발암물질이 나오는 석면 교실, 쪼그려 앉아야 하는 변기를 가진, 사용하는 학교들이 여전히 많다는 사실도 그리 심각하게 생각하고 있지 않습니다.   게다가 기회 있을 때마다 미래 교육, 맞춤형 교육을 이야기하면서 과밀학급, 과대 학교에다 늘어나는 학급 수는 외면하고 있습니다. 학생 수가 줄어든다고 교사 정원부터 3000명이나 감축하고 있으니 할 말을 잃게 합니다. 교육 선진국에서 하고 있는 1교실 다교사제 도입은커녕 고교학점제처럼 이미 준비하고 시행 중인 교육개혁마저 흔들릴 것입니다.   그래서 저는 묻지 않을 수 없습니다. 본인과 본인 자녀들은 석면과 지진 대책도 없는 40년 이상 된 노후건물에서 지내도 괜찮습니까? 또 학생 수가 줄어 교육예산 줄여야 한다는 논리라면 최근 10년간 입영한 현역병 수가 27만 4000명에서 15만 4000명으로 절반가량 줄어들었으니 국방예산 절반으로 삭감하자면 동의하시겠습니까? 우리 아이들 수가 줄어들면 들수록 그 소중함은 몇 배 더 커집니다. 그래서 더 많은 지원과 정책이 뒤따라야 합니다.   우리가 유․초․중 교육예산 감축을 논하는 것과 달리 OECD 선진국들은 코로나로 취약해진 아이들을 위한 예산 등을 포함해 반대로 교육예산을 대폭 확대하고 있습니다. 교육이 당장 손에 잡히는 결과가 나오지 않는다는 이유로, 유․초․중등학생들은 투표권이 없다는 이유로 아이들에게 써야 할 예산을 함부로 잘라내서는 안 됩니다.   또한 과거가 아니라 미래를 책임질 수 있는 이들로 교육 분야 인적 쇄신도 다시 해야 합니다. 충분히 지지받고 자란 아이들이 우리 사회를 잘 지탱하고 발전시킬 수 있습니다.   어려워진 대학 재정 문제는 별도의 대학 재정 확충으로 풀어야 합니다. 그래야 유․초․중 교육도, 고등교육도 제대로 이루어질 수 있습니다. 정부가 져야 할 책임을 어린아이들에게 떠넘기는 식인 지방교육재정교부금의 고등교육 전용에 단호히 반대합니다.   끝까지 경청해 주셔서 감사합니다.      "
